{
  "schema_version": "1.0",
  "project_id": "001-the-ai-race-no-one-can-afford-to-win",
  "duration_seconds": 857.29,
  "policy": {
    "minimum_distinct_music_states": 4,
    "single_tonal_world_required": true,
    "narration_ducking_required": true,
    "random_whoosh_glitch_boom_forbidden": true,
    "silence_may_be_used_as_an_editorial_cue": true,
    "full_render_requires_all_cues_ready": true,
    "policy_note": "continuous_single_loop_forbidden (which required >=2 distinct cue tracks) has been replaced by single_tonal_world_required: the goal is one continuous musical backbone with energy automation, not a mandated minimum number of distinct audio files. See docs/canonical-candidate-audit.md section 4."
  },
  "proof_score": {
    "status": "ready",
    "track_id": "sb_signal_to_noise",
    "duration_seconds": 150,
    "asset": "assets/music/approved_bed.mp3",
    "license": "CC BY 4.0",
    "attribution_file": "assets/music/approved_bed.provenance.json",
    "sections": [
      {
        "id": "controlled_tension",
        "start": 0,
        "end": 35,
        "function": "Opening paradox and competitive pressure"
      },
      {
        "id": "present_tense_turn",
        "start": 35,
        "end": 59.62,
        "function": "Safety frameworks, governance lag, and the present-tense emphasis beat"
      },
      {
        "id": "analytical_unease",
        "start": 59.62,
        "end": 93.4,
        "function": "Controlled evaluation evidence and scenario mechanics"
      },
      {
        "id": "engineered_pressure",
        "start": 93.4,
        "end": 126.56,
        "function": "Replacement condition, deliberation, result, and limitation setup"
      },
      {
        "id": "reflective_release",
        "start": 126.56,
        "end": 150,
        "function": "Controlled-test limitation, recap, and clean branded release"
      }
    ]
  },
  "full_cues": [
    {
      "cue_id": "CUE_01_RACE_PARADOX",
      "section_id": "SEC_01_RACE_PARADOX",
      "start": 0,
      "end": 58.97,
      "state": "controlled_tension",
      "energy_start": 0.28,
      "energy_end": 0.58,
      "function": "Create curiosity, then reveal competitive pressure without sounding like a trailer.",
      "instrumentation": "low tonal pulse, restrained harmonic bed, sparse upper texture",
      "transition_out": "thin to near-silence before the controlled-test evidence",
      "status": "ready",
      "track_id": "sb_signal_to_noise_nomelody"
    },
    {
      "cue_id": "CUE_02_CONTROLLED_EVIDENCE",
      "section_id": "SEC_02_CONTROLLED_EVIDENCE",
      "start": 58.97,
      "end": 135.37,
      "state": "analytical_unease",
      "energy_start": 0.32,
      "energy_end": 0.62,
      "function": "Support document reading and make the experiment feel procedural rather than sensational.",
      "instrumentation": "minimal synth interval, dry pulse, low-frequency movement",
      "transition_out": "introduce a faster rhythmic element under the competition pivot",
      "status": "ready",
      "track_id": "sb_signal_to_noise_nomelody"
    },
    {
      "cue_id": "CUE_03_INCENTIVE_RACE",
      "section_id": "SEC_03_INCENTIVE_RACE",
      "start": 135.37,
      "end": 183.83,
      "state": "accelerating_pressure",
      "energy_start": 0.48,
      "energy_end": 0.76,
      "function": "Express market and geopolitical acceleration through rhythm rather than loudness.",
      "instrumentation": "measured percussion, arpeggiated pulse, widening harmonic field",
      "transition_out": "hard rhythmic reduction before real-world misuse evidence",
      "status": "ready",
      "track_id": "sb_signal_to_noise"
    },
    {
      "cue_id": "CUE_04_REAL_WORLD_MISUSE",
      "section_id": "SEC_04_REAL_WORLD_MISUSE",
      "start": 183.83,
      "end": 385.2,
      "state": "procedural_threat",
      "energy_start": 0.44,
      "energy_end": 0.72,
      "function": "Keep cyber and biological evidence tense but factual, with room for attribution caveats.",
      "instrumentation": "low pulse, muted impacts at evidence transitions, no glitch clich\u00e9s",
      "transition_out": "release tension into uncertainty rather than resolve it",
      "status": "ready",
      "track_id": "sb_signal_to_noise_nomelody"
    },
    {
      "cue_id": "CUE_05_WORK_CONCENTRATION",
      "section_id": "SEC_05_WORK_AND_CONCENTRATION",
      "start": 385.2,
      "end": 441.23,
      "state": "uncertain_transition",
      "energy_start": 0.3,
      "energy_end": 0.5,
      "function": "Shift from immediate misuse to slower social and economic uncertainty.",
      "instrumentation": "warmer sustained tones, irregular soft pulse, reduced low end",
      "transition_out": "introduce institutional weight for regulation",
      "status": "ready",
      "track_id": "sb_signal_to_noise_nomelody"
    },
    {
      "cue_id": "CUE_06_REGULATION_PARADOX",
      "section_id": "SEC_06_REGULATION_PARADOX",
      "start": 441.23,
      "end": 536.37,
      "state": "institutional_gravity",
      "energy_start": 0.4,
      "energy_end": 0.56,
      "function": "Give legal and governance material weight without presenting regulation as a simple solution.",
      "instrumentation": "measured low strings or synth brass, sparse clockless pulse",
      "transition_out": "split into two balanced tonal voices for open versus closed",
      "status": "ready",
      "track_id": "sb_signal_to_noise"
    },
    {
      "cue_id": "CUE_07_OPEN_CLOSED",
      "section_id": "SEC_07_OPEN_CLOSED",
      "start": 536.37,
      "end": 589.57,
      "state": "balanced_tension",
      "energy_start": 0.46,
      "energy_end": 0.58,
      "function": "Hold both sides of the trade-off in tension without musically declaring a winner.",
      "instrumentation": "two complementary harmonic motifs, restrained stereo separation",
      "transition_out": "resolve rhythm while preserving harmonic uncertainty",
      "status": "ready",
      "track_id": "sb_signal_to_noise_nomelody"
    },
    {
      "cue_id": "CUE_08_SAFETY_ARCHITECTURE",
      "section_id": "SEC_08_SAFETY_ARCHITECTURE",
      "start": 589.57,
      "end": 705.8,
      "state": "constructive_momentum",
      "energy_start": 0.42,
      "energy_end": 0.68,
      "function": "Support a credible path forward and give safeguards forward motion.",
      "instrumentation": "clear pulse, brighter harmonic layer, controlled lift",
      "transition_out": "remove pulse and leave a broad reflective bed",
      "status": "ready",
      "track_id": "sb_signal_to_noise"
    },
    {
      "cue_id": "CUE_09_FINAL_PARADOX",
      "section_id": "SEC_09_FINAL_PARADOX",
      "start": 705.8,
      "end": 857.29,
      "state": "reflective_resolution",
      "energy_start": 0.46,
      "energy_end": 0.08,
      "function": "Return to human agency and end with thought rather than triumph or catastrophe.",
      "instrumentation": "wide sustained harmony, sparse piano-like tone, long natural decay",
      "transition_out": "four-to-six-second clean release into black",
      "status": "ready",
      "track_id": "sb_signal_to_noise"
    }
  ]
}
